{
  "$schema": "https://json-schema.org/draft/2020-12/schema",
  "$id": "https://dps.local/contracts/edge.bridge.directive.v1.schema.json",
  "title": "Windows Edge directive to Zenno bridge v1",
  "x-dps-auth-spec": "edge.bridge.directive.v1.auth.json",
  "type": "object",
  "additionalProperties": false,
  "required": [
    "schema_version",
    "contract_id",
    "producer_module",
    "soul_id",
    "device_binding_id",
    "platform_account_id",
    "trace_id",
    "idempotency_key",
    "occurred_at",
    "privacy_class",
    "auth_key_id",
    "auth_nonce",
    "auth_issued_at",
    "auth_body_sha256",
    "auth_proof",
    "directive_kind",
    "command_id",
    "action_kind",
    "step_kind",
    "selector",
    "text",
    "wait_ms",
    "expected_postcondition"
  ],
  "properties": {
    "schema_version": {"const": "1.0"},
    "contract_id": {"const": "edge.bridge.directive/v1"},
    "producer_module": {"const": "windows-edge-supervisor"},
    "soul_id": {"type": "string", "pattern": "^soul_[a-f0-9]{64}$(?![\\s\\S])"},
    "device_binding_id": {"type": "string", "pattern": "^db_[a-f0-9]{32}$(?![\\s\\S])"},
    "platform_account_id": {"type": "string", "pattern": "^pa_[a-f0-9]{32}$(?![\\s\\S])"},
    "trace_id": {"type": "string", "pattern": "^trace_[a-f0-9]{32}$(?![\\s\\S])"},
    "idempotency_key": {"type": "string", "pattern": "^idem_[a-f0-9]{64}$(?![\\s\\S])"},
    "occurred_at": {"type": "string", "format": "date-time", "pattern": "^(?!0000)[0-9]{4}-[0-9]{2}-[0-9]{2}T[0-9]{2}:[0-5][0-9]:[0-5][0-9](?:\\.[0-9]+)?(?:Z|\\+00:00)$(?![\\s\\S])"},
    "privacy_class": {"enum": ["internal", "personal", "sensitive"]},
    "auth_key_id": {"type": "string", "minLength": 71, "maxLength": 71, "pattern": "^sha256_[a-f0-9]{64}$(?![\\s\\S])"},
    "auth_nonce": {"type": "string", "minLength": 64, "maxLength": 64, "pattern": "^[a-f0-9]{64}$(?![\\s\\S])"},
    "auth_issued_at": {"type": "string", "format": "date-time", "pattern": "^(?!0000)[0-9]{4}-[0-9]{2}-[0-9]{2}T[0-9]{2}:[0-5][0-9]:[0-5][0-9](?:\\.[0-9]+)?(?:Z|\\+00:00)$(?![\\s\\S])"},
    "auth_body_sha256": {"type": "string", "minLength": 64, "maxLength": 64, "pattern": "^[a-f0-9]{64}$(?![\\s\\S])"},
    "auth_proof": {"type": "string", "minLength": 64, "maxLength": 2048, "pattern": "^(?:[A-Za-z0-9+/]{4})*(?:[A-Za-z0-9+/]{2}==|[A-Za-z0-9+/]{3}=)?$(?![\\s\\S])"},
    "directive_kind": {"enum": ["COMMAND", "ACK", "WAIT"]},
    "command_id": {"type": ["string", "null"], "minLength": 1, "maxLength": 128},
    "action_kind": {"type": ["string", "null"], "enum": ["OBSERVE", "LOCATE", "VERIFY", "WAIT", "TAP", "TYPE", null]},
    "step_kind": {"type": ["string", "null"], "enum": ["OBSERVE_SCREEN", "LOCATE_SELECTOR", "VERIFY_POSTCONDITION", "WAIT_DURATION", "TAP_SELECTOR", "TYPE_TEXT", null]},
    "selector": {"type": ["string", "null"], "maxLength": 2048},
    "text": {"type": ["string", "null"], "maxLength": 4096},
    "wait_ms": {"type": ["integer", "null"], "minimum": 0, "maximum": 300000},
    "expected_postcondition": {"type": ["string", "null"], "maxLength": 2048}
  },
  "allOf": [
    {
      "if": {"properties": {"directive_kind": {"const": "COMMAND"}}, "required": ["directive_kind"]},
      "then": {
        "properties": {
          "command_id": {"type": "string", "minLength": 1, "maxLength": 128},
          "action_kind": {"enum": ["OBSERVE", "LOCATE", "VERIFY", "WAIT", "TAP", "TYPE"]},
          "step_kind": {"enum": ["OBSERVE_SCREEN", "LOCATE_SELECTOR", "VERIFY_POSTCONDITION", "WAIT_DURATION", "TAP_SELECTOR", "TYPE_TEXT"]}
        },
        "oneOf": [
          {"properties": {"action_kind": {"const": "OBSERVE"}, "step_kind": {"const": "OBSERVE_SCREEN"}}},
          {"properties": {"action_kind": {"const": "LOCATE"}, "step_kind": {"const": "LOCATE_SELECTOR"}, "selector": {"type": "string", "minLength": 1}}},
          {"properties": {"action_kind": {"const": "VERIFY"}, "step_kind": {"const": "VERIFY_POSTCONDITION"}, "selector": {"type": "string", "minLength": 1}}},
          {"properties": {"action_kind": {"const": "WAIT"}, "step_kind": {"const": "WAIT_DURATION"}, "wait_ms": {"type": "integer"}}},
          {"properties": {"action_kind": {"const": "TAP"}, "step_kind": {"const": "TAP_SELECTOR"}, "selector": {"type": "string", "minLength": 1}}},
          {"properties": {"action_kind": {"const": "TYPE"}, "step_kind": {"const": "TYPE_TEXT"}, "text": {"type": "string", "minLength": 1}}}
        ]
      }
    },
    {
      "if": {
        "properties": {"directive_kind": {"enum": ["ACK", "WAIT"]}},
        "required": ["directive_kind"]
      },
      "then": {
        "properties": {
          "command_id": {"type": "null"},
          "action_kind": {"type": "null"},
          "step_kind": {"type": "null"},
          "selector": {"type": "null"},
          "text": {"type": "null"},
          "wait_ms": {"type": "null"},
          "expected_postcondition": {"type": "null"}
        }
      }
    }
  ]
}
