{
  "schema_version": "1.0",
  "contract_id": "edge.bridge.directive/v1",
  "producer_module": "windows-edge-supervisor",
  "soul_id": "soul_aaaaaaaaaaaaaaaaaaaaaaaaaaaaaaaaaaaaaaaaaaaaaaaaaaaaaaaaaaaaaaaa",
  "device_binding_id": "db_bbbbbbbbbbbbbbbbbbbbbbbbbbbbbbbb",
  "platform_account_id": "pa_cccccccccccccccccccccccccccccccc",
  "trace_id": "trace_dddddddddddddddddddddddddddddddd",
  "idempotency_key": "idem_eeeeeeeeeeeeeeeeeeeeeeeeeeeeeeeeeeeeeeeeeeeeeeeeeeeeeeeeeeeeeeee",
  "occurred_at": "2026-07-15T00:00:00Z",
  "privacy_class": "personal",
  "auth_key_id": "sha256_f40bc385ddac10a5ebadf4bb4cebb902897a5b631590fdf8fbfac35d31ea8394",
  "auth_nonce": "1111111111111111111111111111111111111111111111111111111111111111",
  "auth_issued_at": "2026-07-15T00:00:01Z",
  "auth_body_sha256": "4d1777ba494fcbb41fd0830348cf021bfc399db002a4dcc7cf0b3383bfb2167b",
  "auth_proof": "TGoaSuKzV1o0VkYtbkvj/0pym0aUSOTyuTs9EmCJM4VJqx95USirGV68r1Cm/1eUwOuwcdlV2CLhxBfljPHADo90iEhdcJTGa/XnGzEuJoJAoHPU6FJt7xfEP+bSxmwds0VcKBR72aO1I+nrHm5VrOWr9UAVeOJqYjk9yxzdO4P6xgchAMJAu4/wyp/ebyZmPeKBilAXgIXv51dVYKrLORxi/bkEaNQgCPW7Q2kUj/DG0jbxGVd8TputTGckN98dclCwsthUQODxojWZIzyijl3bWm+BrbkTvCuq7gkqGDZTa9SF81bP22CMKOnpUvyPk1Yhwo73JvWNJrzA5nUlvQ==",
  "directive_kind": "COMMAND",
  "command_id": "command-directive-golden-1",
  "action_kind": "TYPE",
  "step_kind": "TYPE_TEXT",
  "selector": "fixture:input",
  "text": "hello\n世界",
  "wait_ms": null,
  "expected_postcondition": "fixture contains text"
}
